name,mean,stddev,min,max,runs,sum,sum_squared
signal low to high same core,971.2179,23.78885578564039,944,1689,100000,97121790,94383011894
signal high to low same core,516.18716,19.28573076485147,514,1211,100000,51618716,26682112356
signal high to low cross core,483.24771,20.14544389572733,478,1179,100000,48324771,23393418813
signal 2way low to high same core,1939.69662,29.848659946060586,1896,2678,100000,193969662,376331392014
signal 2way low to high cross core,2100.82227,35.781031316155904,2034,2911,100000,210082227,441473449233
